<?xml version="1.0" encoding="utf-8"?>
<Catalog xmlns:xsi="http://www.w3.org/2001/XMLSchema-instance" xsi:noNamespaceSchemaLocation="../../../../schemas/SchemaRequirementData.xsd">
    <CRequirement id="LearnProtossAirArmor1">
        <NodeArray index="Show" Link="AndEqCountUpgradeProtossAirArmorsLevel1QueuedOrBetter0AllowUnitStargate"/>
    </CRequirement>
    <CRequirement id="LearnProtossAirArmor2">
        <NodeArray index="Show" Link="AndEqCountUpgradeProtossAirArmorsLevel2QueuedOrBetter0AllowUnitStargate"/>
    </CRequirement>
    <CRequirement id="LearnProtossAirArmor3">
        <NodeArray index="Show" Link="AndEqCountUpgradeProtossAirArmorsLevel3QueuedOrBetter0AllowUnitStargate"/>
    </CRequirement>
    <CRequirement id="LearnProtossAirWeapon1">
        <NodeArray index="Show" Link="AndEqCountUpgradeProtossAirWeaponsLevel1QueuedOrBetter0AllowUnitStargate"/>
    </CRequirement>
    <CRequirement id="LearnProtossAirWeapon2">
        <NodeArray index="Show" Link="AndEqCountUpgradeProtossAirWeaponsLevel2QueuedOrBetter0AllowUnitStargate"/>
    </CRequirement>
    <CRequirement id="LearnProtossAirWeapon3">
        <NodeArray index="Show" Link="AndEqCountUpgradeProtossAirWeaponsLevel3QueuedOrBetter0AllowUnitStargate"/>
    </CRequirement>
</Catalog>
